{
  "id": "unconscious",
  "name": "Unconscious",
  "description": "Out cold at 0 HP: can't move or act, attacks against it have advantage, and a hit from within 5 feet is a critical hit.",
  "flags": [
    "unconscious",
    "downed",
    "cantAct",
    "cantMove"
  ],
  "attackersAdvantage": true,
  "hitsAreCritical": true,
  "ends": [
    "healed"
  ],
  "removes": [
    "hidden"
  ]
}
